"challenge_id","question_id","question_text","answer_id","answer_text"
47,232,"For calendar year 2019, what dollar amount is given for the ceiling?",232,"$726,525"
47,233,"In FY2015, what percentage was the capital ratio estimated to be?",233,"2.07%"
47,234,"According to the text, how late must the borrower be for the mortgage to be considered in default?",234,"30 days late"
47,235,"The text states servicers must initiate foreclosure when six monthly installments are due and unpaid, except when what?",235,prohibited by law
48,236,What date is given for Maltepe University being established?,236,"July 9, 1997"
48,237,"In the Ojibwe language, Kenjgewin Teg means what?",237,a place of knowledge
48,238,What lifespan years are listed for the Anglican priest named John Camm?,238,"1718–1778"
48,239,Which single word in the parenthesis signals that Kenjgewin Teg had a prior name?,239,formerly
48,240,"Which two-word qualifier appears before the phrase ""student loans must be repaid""?",240,notable exceptions
49,241,"How many locations are TAP managers assigned to where Health, Safety, and Work-Life offices are located?",241,"13 installations"
49,242,In what year was the most recent Commandant Instruction issued?,242,"2003"
49,243,What month and year did officials say a new TAP Commandant Instruction is planned to be issued?,243,May 2018
49,244,What does the Coast Guard lack that is cited as a major reason the TAP participation data are not reliable?,244,an up-to-date Commandant Instruction
49,245,"What two-word phrase appears immediately after “Employment Workshop,” in the description of the three required courses?",245,unless exempt
50,246,"For the film Pal Pal Dil Ke Paas, how much was collected on the opening day?",246,₹1.15 crore
50,247,Where was Coney Island Baby shot?,247,"Sligo, Ireland"
50,248,"For the short film Rakka, what date is given for its release on YouTube and Steam?",248,"14 June 2017"
50,249,"For Coney Island Baby, what award did Amy Hobby win for ""Best First Time Director""?",249,Jury Award
50,250,"In Royal Tramp II, by what time must Lung-er have sex with a man (otherwise she will die)?",250,before dawn
51,251,What quantity of news domain parallel corpus is stated for the Japanese–Russian pair?,251,"12k lines"
51,252,What total count was obtained as a result of the manual compilation?,252,"1,654 lines"
51,253,What was selected at random to create the test set?,253,"600 trilingual sentences"
51,254,"According to the text, multilingual approaches are effective only when the parent target or source language is what?",254,relatively resource-rich
51,255,"According to the note, what action was not performed with multiple lines?",255,merged two or more lines
52,256,"Which title is given as an alternate reference, stated as being due to a marriage to Zhu Ju?",256,Princess Zhu
52,257,What exact date is stated for the coup d'état staged by Sun Xiu against the regent Sun Chen?,257,"18 January 259"
52,258,How many elephants are stated to have been in Abrahah's army?,258,thirteen
52,259,Which place is named as the vicarship appointment following approval by Oliver Cromwell's Commission of Triers in 1658?,259,Winterborne Whitechurch
52,260,"According to the text, after his father's death, Shaiba was raised in Yathrib with his mother and her family until about what age?",260,about the age of eight
53,261,Which item is stated as being used to strangle one's opponent?,261,Garrote wire
53,262,"In parentheses, what quoted meaning is given for the Italian word associated with Amaretto?",262,a little bitter
53,263,What quoted term is identified as another common term in the U.S.?,263,First Chair
53,264,The text gives an exception for who plays a violin solo; what is the named case for that exception?,264,a concerto
53,265,"If the concertmaster believes a section is not adequately tuned, what will he or she signal the oboe player to play?",265,"another ""A."""
54,266,In what year was Central Park Brass formed?,266,"2002"
54,267,What is the release date stated for The Punisher?,267,"April 16, 2004"
54,268,"What is Casa Loma's elevation above sea level, in metres?",268,"140"
54,269,Proto-Slavic is defined as the last stage of the language preceding what?,269,the geographical split of the historical Slavic languages
54,270,B-Sides was released only in which location?,270,Europe
55,271,How many workers are stated for the nation's largest employer?,271,over two million
55,272,What minimum examination rating is stated for eligibility for appointment?,272,"70 or more"
55,273,Which label range is used for the 15-grade annual basic pay schedule?,273,"""GS-1"" through ""GS-15."""
55,274,How many individuals must an appointing official be able to consider for each position?,274,at least three
55,275,"A term appointment lasts for more than one year, but less than how many years?",275,four years
56,276,What is the estimated number of workers employed in the animal slaughtering and processing industry in 2016?,276,"481,000"
56,277,"As of February 2017, how many meat and poultry plants were there in the United States?",277,"5,282"
56,278,"Programmed inspections are planned based on injury incidence rates, previous citation history, or what?",278,random selection
56,279,OSHA does not fine which group?,279,federal agencies
56,280,When was the MOU between FSIS and FDA most recently amended?,280,January 2000
57,281,"In the parenthetical date range for John Gustav Adolfi, what is the first date shown?",281,"February 19, 1888"
57,282,What 4-digit year appears in the sentence identifying Who's Your Daddy? as an American comedy film?,282,"2002"
57,283,What alternative title is stated for Who's Your Brother?,283,Keep to the Right
57,284,What dollar amount is given for the estimated US box office earnings of The Last Outpost in 1951?,284,"$1,225,000"
57,285,"According to the plot description, how long does Gray Cloud give Vance to free the prisoners?",285,"24 hours"
58,286,Which year is given for Adam Housley joining Fox News Channel (FNC)?,286,"2001"
58,287,What name is given for the National Security Council's senior director for intelligence?,287,Ezra Cohen-Watnick
58,288,What page code did Mark Halperin mention for the item in his hard copy?,288,A16
58,289,"In the stated standard for senior officials learning incidentally collected U.S. person names, what must it have some of?",289,foreign intelligence value
58,290,"In the masking rule for incidentally collected American names, besides ""national security"" and ""crime,"" what additional condition is listed as an exception?",290,if their security is threatened in any way
59,291,On what date was Husain Bey Gouta invested as the heir apparent of the Beylik of Tunis?,291,"1 October 1955"
59,292,"What title meaning ""Bey of the Camp"" is stated as being received by Husain Bey Gouta?",292,Bey al-Mahalla
59,293,On what date was the 2020 season declared void?,293,"20 January 2021"
59,294,The text states the 2020 season was suspended on 27 March 2020 due to what?,294,COVID-19 pandemic
59,295,The club career statistics are stated as current 'As of match played' on what date?,295,"8 July 2023"
60,296,What number is given as the population at the 2010 census for the census-designated place on North Hutchinson Island?,296,"3,501"
60,297,Which population figure is stated for the rural commune in the PEPAM sentence?,297,"43,460"
60,298,What is the United Kingdom theatrical release date for Snow White and the Huntsman?,298,"May 30, 2012"
60,299,"In the opening description of the 2000 adventure drama film directed by Danny Boyle, what year is associated with the novel it is based on?",299,"1996"
60,300,"In the sentence describing the prequel/sequel with new characters played by Emily Blunt and Jessica Chastain, what is the stated form of Stewart’s appearance?",300,archive footage
61,301,How many items does the QASent dataset consist of?,301,"277 questions"
61,302,"After segmentation by NLP4J, how many are indexed (as shown in parentheses)?",302,"28.7M+"
61,303,What is the parenthesized abbreviation associated with mean average precision?,303,MAP
61,304,Selection-based QA remains still important because of its practical value to what?,304,real applications
61,305,Which task does not assume the presence of the answer context within the provided document?,305,answer triggering
62,306,"In Passage 2, what year is given for the melting-out discovery of the Alpine glacier find?",306,"1991"
62,307,What is the rare haplogroup named for the placement described for the Y chromosome?,307,G2A4 haplogroup
62,308,Which publication is named as the place where the genome analysis appeared this week?,308,Nature Communications
62,309,"In Passage 2, what exact phrase states the inheritance path for the mitochondrial DNA?",309,only the female line
62,310,The text says they won't have a clear picture of how Lyme disease evolves until researchers do what?,310,compare the B. burgdorferi genome from Ötzi with more modern incarnations of the pathogen
63,311,What year is stated for the publication of Rector's childhood diaries?,311,"2004"
63,312,Which schooling level is explicitly stated as not attended by Duffy?,312,high school
63,313,What is the parenthesized year shown next to the cartoon title “The 'Outstretched Hand'”?,313,"1940"
63,314,What date is given for when Upton and Blanchett married?,314,"29 December 1997"
63,315,Which named person is identified as the president connected to Shekhawat being a spouse?,315,Pratibha Patil
64,316,"In the Area and climate section, what length is given for the desert?",316,"120 mi"
64,317,Which Köppen code appears in parentheses after the cold desert climate label?,317,BWk
64,318,"For all backroad travel on the Navajo Nation, what is required?",318,A permit
64,319,Which entity is stated as owning the premium beer brand Leffe?,319,InBev Belgium
64,320,In what year was the Berlin Zoological Garden opened?,320,"1844"
65,321,What is the stated total length value for the River Itchen?,321,"28 mi"
65,322,What year is given for the Domesday Book in the Itchen Abbas sentence?,322,"1086"
65,323,Which named bridge is described as being originally opened in 1799?,323,Northam Bridge
65,324,Who is stated to be the navigation authority for the tidal section below Swaythling?,324,Port of Southampton
65,325,"Braxy is usually seen in young sheep, in particular those not protected with what?",325,a Clostridial vaccine
66,326,On what date did James Chadwick receive a knighthood in the New Year Honours?,326,"1 January 1945"
66,327,What cover name was James Chadwick given for security reasons?,327,James Chaffee
66,328,How much did Chadwick start by spending to refurbish the antiquated laboratories at Liverpool?,328,£700
66,329,What did the 1851 Exhibition Scholarship allow Chadwick to do?,329,study and research at a university in continental Europe
66,330,"During his November 1943 tour of Manhattan Project facilities, which site was Chadwick not allowed to see?",330,the Hanford Site
67,331,What date is given for when the official lecture was recorded?,331,June 4
67,332,How many sentences are explicitly counted in the lecture section describing Moby-Dick?,332,"78 sentences"
67,333,Who is named as filling in at the December ceremony?,333,Patti Smith
67,334,Which institution is stated as requiring a lecture?,334,the Swedish Academy
67,335,What prize amount is mentioned as something he could give to the online-summary author?,335,"$923,000"
68,336,The effect is described as being named after which individual?,336,Isidor Isaac Rabi
68,337,What is σ0 described as being?,337,the 2 × 2 identity matrix
68,338,On what date was the official naming citation published by IAU's WGSBN?,338,"7 February 2022"
68,339,"In the equation for the characteristic angular frequency, ω is shown as equal to what expression after the final equals sign?",339,γ B
68,340,"In the degenerate case where E+ = E−, what does the text state about the characteristic frequency?",340,"0"
69,341,"In Passage 1, what was the trip duration described as normal?",341,"25-minute drive"
69,342,"In Passage 3, what hyphenated size descriptor is used for the Alawite community?",342,"2.5 million-strong"
69,343,"In Passage 2, what limitation is stated for the allowed use of the copy?",343,"personal, non-commercial use only"
69,344,"In Passage 1, what three-word gloss is given for the term ""shabiha""?",344,Arabic for ghosts
69,345,"In Passage 1, families cite home teaching because the drive to school is described as what?",345,too dangerous
70,346,"What is the stated release year of the German-Austrian historical film titled ""Ludwig II""?",346,"2012"
70,347,"Which person is named as a director together with Marie Noëlle for the film ""Ludwig II""?",347,Peter Sehr
70,348,In what year did William Dieterle become a United States citizen?,348,"1937"
70,349,"After which year was ""Trouble in Paradise"" withdrawn from circulation?",349,"1935"
70,350,What date is given for Marie becoming Catholic?,350,"12 October 1874"
71,351,"What is the exact CPU string shown in parentheses after ""single CPU""?",351,Intel i7-5960X
71,352,"What toolkit name appears after the word ""by"" in the sentence about the Chinese Wikipedia corpus?",352,word2vec
71,353,"Which library-and-version string is stated after the word ""with"" in the implementation sentence?",353,Pytorch 1.0
71,354,"In the contrast clause beginning with ""while"", which evaluation setting is named as not taking the limitation?",354,open test
71,355,What is the beam-width value that makes beam search reduce to greedy decoding?,355,$b$=1
72,356,What is the maximum number of enumeration attempts typically allowed for each nonresponsive housing unit?,356,six
72,357,Roughly what percentage of anticipated housing units in the test area self-responded before NRFU started?,357,"45 percent"
72,358,"In the sentence stating that ""NRFU itself"" took place between May 9 and July 31, 2018, what is the start date given?",358,May 9
72,359,What activity is explicitly stated as coming before both portions of Group Quarters fieldwork?,359,Advance Contact activity
72,360,Bureau guidance sets a maximum of how many attempts to interview a proxy respondent?,360,three
73,361,What birth date is shown in parentheses for Edward J. Yates?,361,"September 16, 1918"
73,362,"According to the text, Palmer was born and raised in what place?",362,"Penny Bridge, Barrow-in-Furness"
73,363,American Bandstand is stated as being directed by Yates for what span?,363,"1952 until 1969"
73,364,"In Parvatham's bet, what was Sekhar told he should not tell his brother?",364,about the bet
73,365,How many films did Kishore Sahu direct between 1942 and 1974?,365,"20 films"
74,366,What ISO codes are stated for the official short form of the country name?,366,TLS & TL
74,367,What number is given for the size of the fleet that the Dutch Republic amassed?,367,"2,000 ships"
74,368,"How long did the song ""The Trouble with the Truth"" chart on the Billboard Hot Country Singles and Tracks chart?",368,"20 weeks"
74,369,What named event is stated as the endpoint of the Dutch Republic's existence?,369,Batavian Revolution
74,370,What is the stated maximum number of terms the president of the republic (head of state) of East Timor can serve?,370,two terms
75,371,"In Passage 1, what date appears first inside the parentheses after the full name ""Peter Emil Julius Blum""?",371,"4 May 1925"
75,372,"In Passage 2, what is the birth date shown in parentheses for Lee Eddy?",372,"May 12, 1979"
75,373,"In Passage 7, what length is given for the Cooper Glacier (in nautical miles)?",373,"15 nautical miles"
75,374,"In Passage 7, which person is specified after the phrase ""named by him for""?",374,Kent Cooper
75,375,"In Passage 14, what does the text say to use when a denominator is close to zero?",375,the other one
76,376,What was the Bank of England's nomination deadline for candidates to adorn the new bank note?,376,"19 July"
76,377,On what date was the flag of Uganda adopted?,377,"9 October 1962"
76,378,"In Take Your Pick!, what additional box was there besides boxes 1 to 10?",378,Box 13
76,379,For what period is the post of British Poet Laureate now held?,379,ten years
76,380,Which head movements were prohibited during the 60 seconds?,380,nod or shake their heads
77,381,Where was the 2009 Eurovision Song Contest held?,381,"Moscow, Russia"
77,382,On what date did the song win Melodifestivalen 2009?,382,"14 March 2009"
77,383,How much did Ernman reveal the dress for her Eurovision performance cost (in kronor)?,383,"400,000 kronor"
77,384,"After the words ""lyrics by both"", which two surnames appear?",384,Kempe and Ernman
77,385,"What three-word clause follows the comma in ""All tracks written by Andrés Nusser,""?",385,except where noted
78,386,"Which year is shown on the awards list line that ends with the word ""inductee"" for Scotty Fox?",386,"1995"
78,387,What date appears inside the parentheses after Rob Margolies’s name?,387,"February 28, 1983"
78,388,What quantity is stated for how many pictures Vignola directed?,388,"110 pictures"
78,389,The biography says Palmer co-developed his first directing job’s show with its main star; what is the name given?,389,Leigh Francis
78,390,What reason is given for the originally attached actor for Kim Powers being unable to participate?,390,scheduling conflicts with another film
79,391,What date appears inside parentheses after the name “Stoney Jarrod Case”?,391,"July 7, 1972"
79,392,Which year is stated for the Summer Olympics mentioned for Marc-Kanyan Case’s participation?,392,"1968"
79,393,What month and year are given for when Gregory C. Case began holding the stated position?,393,April 2005
79,394,Name the individual identified as the predecessor in the clause beginning with “succeeding”.,394,Sir Mark Sedwill
79,395,What phrase is given as the reason for the Frontier League season cancellation?,395,the COVID-19 pandemic
80,396,"For Too Many Cooks, what is the last date given in its stated airing range?",396,"4 September 2005"
80,397,Who is named as the host for the second series?,397,Jeni Barnett
80,398,"In the description of La cuisine en dix minutes, what year appears immediately after the words ""published in""?",398,"1930"
80,399,"For the ATM 2000E mine, which producer is stated for its current production?",399,Dynamit Nobel Wien
80,400,"For the ""Ten Minutes"" single, what quantity is stated after the word ""only"" for the clear-vinyl pressings?",400,"100 pressings"
81,401,In what year was the 340B Program created?,401,"1992"
81,402,How many outside pharmacies could each entity contract with under HRSA’s original guidance?,402,one outside pharmacy
81,403,How many entities per year does HRSA now audit?,403,"200 entities"
81,404,"In March 2010, what did HRSA guidance do to the restriction on the number of pharmacies?",404,lifted the restriction
81,405,Covered entities must submit a corrective action plan within how many days of an audit being finalized?,405,"60 days"
82,406,How many wildlife trophies did U.S. citizens import in 2017 alone?,406,"over 650,000"
82,407,Trophy hunting is broadly defined as what action?,407,the killing of animals
82,408,CITES is described as being signed by how many governments?,408,"183 governments"
82,409,"In the ban list statement, what number appears before the words ""range countries""?",409,"13"
82,410,"For Appendix I species, what is stated about trade for commercial purposes?",410,is prohibited
83,411,"In the parenthetical date range after the name, what birth date is shown for Ole Arntzen Lützow?",411,"14 November 1801"
83,412,What exact service span is stated for Harry Albert McMackin as a member in the Legislative Assembly of New Brunswick?,412,"1939 to 1944"
83,413,What cover name is explicitly given for Ole Arntzen?,413,Ørnulf
83,414,Who is stated as appointing Sieben as US Marshal for Minnesota?,414,President John F. Kennedy
83,415,What stated reason caused Mavrias to be left out of the squad to play Southampton?,415,lack of match fitness
84,416,What dimension size were the systems trained with?,416,"1,000"
84,417,What batch size were the systems trained with?,417,"80"
84,418,What dropout rate is used to avoid overfitting?,418,"0.3"
84,419,What is used to compute the correlation between attention loss and word prediction loss?,419,Spearman's rank correlation
84,420,"Which technique did the authors choose not to use, given that POS tags and dependency roles are based on words?",420,BPE
85,421,At which palace in London did Ernst Christian Carl marry on 18 February 1828?,421,Kensington Palace
85,422,How many elephants were in Abrahah's army?,422,thirteen
85,423,In what year was Lyon Cohen elected the first president of the Canadian Jewish Congress?,423,"1919"
85,424,How does the text describe John Wesly's ordination status?,424,Never episcopally ordained
85,425,What Gregorian date (shown in parentheses) did Guillaume Wittouck acquire the castle of Petit-Bigard?,425,"18 May 1800"
86,426,How many essays or discourses are said to exist in the work called The Dissertations?,426,"41"
86,427,"What is the title of Karel Zich's first album, released in 1976?",427,Dům č.5
86,428,"Whose orders are named as the ones whose prompt implementation the ""Department for Special Affairs"" was created to ensure?",428,Dieter Wisliceny's
86,429,"At Charles Buls' initiative in Brussels, besides French, what language did policemen have to be able to speak?",429,Dutch
86,430,To what date does the last record of Charles Emmanuel Biset's life date?,430,"28 September 1693"
87,431,"For the CDP described as being within the town of Sand Lake in Rensselaer County, what number is given for its population at the 2020 census?",431,"2,098"
87,432,"In the history section of the village in Kent County, what year is stated for when it was founded?",432,"1869"
87,433,"For the unincorporated census-designated place in Sawyer and Washburn counties, what population value is stated as of the 2010 census?",433,"178"
87,434,"In the climate description, what three-character code is given in quotes as the map abbreviation?",434,Dfb
87,435,"In the sentence explaining the origin of the Halifax County CDP’s name, what word appears inside quotation marks within the parenthetical that follows the word not?",435,Nathalie
88,436,What numeric limit is stated for the maximum number of staff members allowed to be hired?,436,"150"
88,437,"What reporter citation appears immediately after the case name ""Brockmeyer v. Dun & Bradstreet""?",437,"113 Wis. 2d 561"
88,438,"In the initial citation for Miller v. California, what year is shown in parentheses?",438,"1973"
88,439,"According to the rule described, until what must the court first seized declare about its jurisdiction before the chosen court stays its proceedings no longer?",439,it did not have jurisdiction
88,440,"In the parenthetical definition of an authorized sale, which maker is named first?",440,the patentee
89,441,What numeric rank is given after the words “Alexa rank of” for boardgamegeek.com?,441,"1,745"
89,442,Which date appears inside parentheses immediately after the word “born” in the David Parlett entry?,442,"18 May 1939"
89,443,"In the Yut Equipment description, what total number of stations is stated?",443,twenty-nine
89,444,What term follows the phrase “Also known as” in the Games of physical skill description?,444,dexterity games
89,445,What phrase introduces the stated exception for connecting a path to the edge of the board in Tsuro?,445,unless no other move is available
90,446,Which person is named as the company president at MGM?,446,James Aubrey
90,447,What budget is stated for the film House of Dark Shadows?,447,"$750,000"
90,448,"What venue name appears after the words ""premiered at""?",448,the Marmorhaus
90,449,What time-offset phrase is used to describe when the later film came after the earlier one?,449,one year later
90,450,Which quoted four-word phrase is given as the concern about what children might do?,450,try this at home
91,451,What birth date is given in the parentheses for Vadim Nikolayevich Vlasov?,451,"19 December 1980"
91,452,"In the Meistriliiga clean sheet record sentence, what minute total is stated for Roman Smishko?",452,"1,281 minutes"
91,453,What value is stated for Çelikbilek's career high ATP singles ranking?,453,World No. 154
91,454,"Which team name appears after the words ""plays for"" in Anton Shunto's description?",454,Zhodino-Yuzhnoye
91,455,"In the Miloš Zličić section, what date follows the label ""As of"" under Career statistics?",455,"26 February 2020"
92,456,What year is given for the consequential decision in United States v. Fordice?,456,"1992"
92,457,"How many seats were set aside in the entering class for members of the ""disadvantaged"" group?",457,"16 seats"
92,458,Which phrase identifies the class-rank group that UT Austin would continue to admit automatically?,458,top ten percent
92,459,What must a university’s admissions process be able to withstand for race to be considered?,459,strict scrutiny
92,460,The affirmative obligation to consider race arises only in the context of what?,460,de jure segregation
93,461,What is the parenthetical abbreviation given after the phrase “expected equilibrium freezing/melting point”?,461,eqFMP
93,462,Which Antarctic sound is named as the site of the shallow benthic fish habitat used for the decadal temperature record?,462,McMurdo Sound
93,463,In which journal was the study published?,463,Proceedings of the National Academy of Sciences
